"""bynes equally free-spirited , wealthy ) """
"""film , beautiful self-satisfied 18-year-old mistress """
"""dangerous mind , confusion , pretty """
"""principals cast fine , bishop stevenson """
"""reese sweet , charming co-worker kali """
entertaining drama responds 's doomsday leaders
"""balsiger congenial , average swiss havanna """
"""trey , sandler idea funny , """
"""unfortunately , neglects professional gambler jaguar """
clichйd shallow hard-partying lives gay men
stevie five minutes pregnant italian footballer
skyler plays affection carbonell 's son
erode feelings seem find time six-year-old
lyrical excursion set war-torn iranian kurdistan
add two steal fbi agents chase
two star-crossed set backdrop world dangerous
""", threaten , kidnap , , """
passport imprisoned ins one year asylum
next morning one future convict fianc
years goes away weekend new girlfriend
adam . patrol often crosses job
otte lives disability wife outside amsterdam
drug cartel kill robert protect interests
abusive intoxicated man household visits boyfriend
adam u border agent often crosses
's undercover fbi agent stop 's
"""vesa , 16-year bulgarian , speak """
father sons hiding valleys ireland three
arm closest partner vincent precinct door
clara wild mother runs another man
away strange motel room attacks matt
boy gets comes job spying sharad
police clues suspects nick colleague octopus
agent l xxx cooperate ring going
partly regime nurse decide escape new
story ned notorious brother two men
drug stop kill robert protect corrupt
taco salsa girl assist evil menace
year peter tries family eviction ``
remaining friends rescue captives desperately avoid
two young wake house renting widow
police investigate discover joe knows letting
"""vesa 16-year bulgarian girl , speak """
dies sent rome mysterious surrounding death
begins affair mysterious woman walks library
spirals crack homeless stability life moves
near young crumbling life ireland tours
drug cartel stop nothing robert protect
young living next radical wife helen
rent santa guards girls drugs quick
harry dying wife waiting gun arrive
also away young mario meet bars
already team two agents wild terminal
fast friends soon families near island
former agent runs away fron past
retire ; funk wife sends packing
max decides help fbi dreams kidnapping
sees dean mysterious book old house
harry watching wife waiting gun arrive
story relationship stepfather ( ) young
""", threaten , , , murder """
"""passport , imprisoned ins year asylum """
soon old shore greeted wife arrival
living luxury huge mansion mercedes driveway
spirited new leaves husband sets reclaim
year future murder fianc & #
"""interview police , boyfriend young whose """
behind assassination attempt naboo senator 233
everybody police believe nick harbor .
lapd break motel hiding 's wing
dawn family tie trail murder girl
always boyfriends gain decides friend new
investigate small town detective ) apprehend
high life friends spend spring together
save new york city imminent terrorist
rebecca went away college help keep
yard smuggling ring ' must dante
return plot land agrees search lunna
mr ruler planet moved cats neighborhood
brings tellis 18-months bullet hits woman
island prison d'lf 13 years plots
smart spunky fifteen year lost family
attacks one killed 's partner friend
middle caught lines seek refuge german
two sent missions anakin sent investigate
patricia truck drivers destination strands las
named shana radio kidnapping warn incident
resorting camp nicholas wounding uncle 's
secret agent runs lands & ;
drug kingpin angeles swat city custody
loving wife maya vows help jail
police clues colleague killer giant octopus
frances take break villa beautiful countryside
one week day watched journalist naomi
shirley 12 year-old skeddadled years n't
taco chick salsa girl assist defeating
frank sister caroline arrive attic citizens
next year future fianc & ;
plan slowly unravels sarah suspect husband
discovery emancipation three young couple man