"""self-conscious , glimmer intelligence """
informative looks arab-israel conflict
coming-of-age sneering uncertain girl
'have-yourself-a-happy-little-holocaust life honest deny
maggie designer ms love
singular night-guard duty escape
quiet saigon 1952 first
wife moves manhattan upper-class
katie innocently reagles school
frank sister town investigating
philippa arrested questioned terroristic
""", daughter , ex-football """
suspect arrested discover joe
12-year-old running away near
lando aquitania boyfriend enters
convicted murder bitsey gale
christian 36-year-old confront suicide
12 year old california
two married long living
encounters betts flee douglas
zed girlfriend enlisting sappho
worry two jamar martin
"""vesa 16-year bulgarian , """
tells eighteen hustler smith
young mother moves stepford
city hamburg smuggle falcon
letter whitehall corroborates heroic
witness caught team detain
sergeant kenneth thrown active
couple narc find neighborhood
stumbles old house scotland
jorge barrillo killed ramirez
detective delgado madrid )
lieutenant captured german bulge
however warden chicago lawyer
flooded valley neighbors lived
girlfriend move bed dante
ensues sheriff starts family
patricia vegas threatening katherine
judge crazy couple house
follows relationship stepfather stepson
polish witnesses restrictions nazis
surveillance tasha planning pure
sanitized neighborhood eleanor daily
agent anderson key witness
convinces military robert jail
frank lives `` another
island party coeds coast
"""couple , suspects night """
casual marriage rick widower
first past ex-boyfriend ben
becomes begun break relationship
begins passionate affair mysterious
arrested drugs france two
indian confronts past home
rigged attack romanian killed
assasins force drive escape
become suspicious 's prisoner
detour sheriff bent capturing
boyfriend obsessive bond mysterious
arrested los department city
ends terror begins 15-year
strange harold assigned fran
""", , son daughter-in-law """
blueberry town palomito sheriff
frances take tuscan decides
american students moves lake
patricia strengthens finally quit
fugitive arrives dogville run
arrives isolated dogville run
friday christmas rundown apartment
society sheldon mysterious mobsters
interrogators affair toni employee
years left girlfriend dream
discovers next neighbor claus
nightly surprised night-guard escape
neglecting mom badly bobbi
try collect jie gang-boss
widens ensues residents escape
another belt long renegade-cop
seductive arrested fred convinces
department swat jackson federal
hannah 55 prison held
davidson wild dog trekked
nightmare sanjana starts hearing
woman rebels marries baron
special charged witness harper
exotic brazilian married owner
another relationship ) stepson
american first murdered sergeant
door mitchell hears t-mon
vaughn richard dying aids
17-year-old ( fortunes english
elders home quickly plans
grace arrives dogville gangsters
eddie shot prevails carlos
blueberry stationed town palomito
department terry huston mysterious
meanwhile wolverine investigate past
three roommates every conquer