1, Shanghai is also really exciting (precisely -- skyscrapers galore). Good tweeps in China:  (SH)  (BJ).,1
2,"Recession hit Veronique Branquinho, she has to quit her company, such a shame!",0
3, happy bday!,1
4, http://twitpic.com/4w75p - I like it!!,1
10,My bike was put on hold...should have known that.... argh total bummer,0
13,"I`m in VA for the weekend, my youngest son turns 2 tomorrow......it makes me kinda sad, he is getting so big, check out my twipics",0
14,Its coming out the socket  I feel like my phones hole is not a virgin. That`s how loose it is... :`(,0
15,"So hot today =_=  don`t like it and i hate my new timetable, having such a bad week",0
16, Miss you,0
17,Cramps . . .,0
18, you guys didn`t say hi or answer my questions yesterday  but nice songs.,1
20,Stupid storm. No river for us tonight,0
21,My dead grandpa pays more attention to me than you do,0
22,"... need retail therapy, bad. AHHH.....gimme money geebus",0
25, thats so cool,1
28, look who I found just for you  --->  http://twitter.com/DJT2009,1
29,"No AC, the fan doesnt swing our way ... we are sweating it out on a hot humid day",0
35,Watching Body of Lies...good film,1
36,Happy mothers day mumm  xoxo,1
39,"feels sorry every time I`m printing out, I use like 200 new papers",0
40, 4n? ma rog  never heard of it  esti beat acum? u tweet too much,0
44," Hi there.  I agree!  Small children should be running about happy, not breaking down in tears",1
47,thinks SG is wonderful,1
48,  im really sorry i know wallah how u feel this life is shittttttttt,0
49,Not happy,0
52,I`m so very tired...and have insomnia.,0
53, Thanks Ennio,1
55," You seem nice, you`re generous and you know your stuff",1
65,I just cried whilst watching hollyoaks  .. i need a life! lol,0
66,"Hi all, just recovering from a party, looking forward to an exciting bank holiday around the diy shops...life cant get much better.surely",1
70,"On the monday, so i wont be able to be with you!  i love you",1
71," Ur so cute..I`m a fan of Dream A Little Dream, This Kiss and appearances like in Dawson`s Creek  Make more flicks!",1
74,_LaMont yr very young looking dude,1
76,AT&T cheated the system and now I have no Green Day tickets  **** you AT&T!,0
78," yep, i wish they were all playing dubiln",1
80, Yay for Block Party!  You`re the BOMB! Blockheads <3 Dave!   Thanks for supporting NKOTB!,1
84, Thank you!  I`m working on `s,1
90,The underwire in my bra is sticking out and poking me in the armpit,0
91,Happy Mothers Day!!!,1
94,Happy star wars day! May the fourth be with you,1
96,i just watched Marley & Me...i cried so hard!,0
102,"Just had a great study time followed by a delicious Japanese meal with Arty! Now, trying to get back into the study mood",1
103,FML not having a car is prohibiting finding a job,0
109, yeah i need his fricken cell number ive tried his home for months and hes too busy. i miss braddddddddd,0
113, yay about breaking 200!,1
114, bahah sadly I am not,0
115, i always have those for my Champions League parties  Tis awesome,1
116," well, not all. just stay away from those kinds and surround yourself with those who don`t. happy mother`s day to ur mom, treiz!",1
118, thats rough. hubby had knee surgery but it did help him in the end. Let us know the results. We`ll keep him in our prayers,0
120,"Playin City of Villains, wishin my buddies were playin with me.....",1
124, I liked it.  Did you record it yourself?  If so you have a very soothing voice.,1
126," Folks thought it was hilarious when I told them the story, and then they saw the shirt I wore tonight.  Laughter all night.",1
127, you`re the absoute best,1
130, Welcome!,1
134,"just got home from a nice party, just not tired yet",1
135,Now I have a sunburn,0
136,I have the Job  this is a nice day it can not be better,1
139, love your books,1
140,ok so this eye doctor guy is taking forever and i`m sitting in a cold room by myself...what? A jerk!,0
142, well thank your phone for me.,1
143, why would they take a photo with stuffed animals?! that`s pretty funny,1
145,tikcets are only �91...each...BUT I SO WANT TO GO,1
146, Happy Mothers Day,1
147, It`s gonna be hot here today too. today is Ryan`s last day of pre-k. I can`t believe it!  I`ve been a SAHM since I had him!,0
149,"Oh, **** me. I`ve just returned from the Supermarket Of Doom to find that I have nothing to drink here.",0
151,"D-group Saturday`s, with a little bit of football, an hour nap, 3 hours of soccer, basketball in the TSU and Yogurtland... Life`s Good",1
153,Ahhh my mommie got me new sheets for my bed  so comfy,1
156,is pretty dang tired. but chambers class is for napping.,0
157,i have to poop...   is hogging the shitter,0
159,Happy muthath`s day to all moms!!! I salute you!,1
160,Hahaha! Alright  ..,1
161, Aren`t you suppossed to support the local economy ... LOL ... good for you and congrats,1
166," E.L.O.  wow, brings back so many happy memories.  LOVE this band!..and yes, I know I`m showing my age but I don`t care",1
167, that`s a very cute picture ... but you don`t get fat from licking BBQs ... he must have found some chops on someone else`s ...,1
174,Twitter has spoiled all the fun. Frustratingly slow!!  couldnt even bid properly!,0
175,_chick haha. I completely agree,1
178,Going to bed after a great night with a friend  glad to know she has the same feelings about classes as someone else,1
180,it`s nice to leave the office when the sun is still up,1
181,I will miss the soccer moms,0
188, Sadly I think I know exactly were you put it--in the expired drawer   Those things have a life span of less than two years,0
189," Too much? No, not unless one of the pillows ends up suffocating the one sleeping next to you.",0
191,Wow that was fast...next up Soderling or Ferrer. Gilles Simon lost,0
193, glad to know that the ad display problem was due to a firewall config at yr office. phew!,1
198,Happy #StarWarsDay. May the 4th be with you!  From everyone _paintball,1
200,St joe is dirty.,0
203,I hate my life,0
205, ****! natalya! you gotta tell me whats going on!!! i`d call you but i lost all my phone numbers when i broke my blackberry,0
206,just thought about how unfair 3 ppl have been 2 me n got depressed again  HATERS!!!,0
209, Panchito`s burfday party tonight... wish you were here kiddo!,1
212,the best things in life are free  x,1
213,misses my Mom today. She was my Best Friend and even though she has been gone several yrs I still miss her dearly. Happy Mother`s Day,1
217,http://twitpic.com/665jw The racoons ate our bread!,0
220,No launch today. Teacher changed plans and we watched a stupid move about tesla,0
221,  it`s very pleasant. i sooo rarely just have time to kill...,1
223,__O lol but tiz a good song,1
227,_Wright THANK YOU! 'Return of the Mack' is THE jam!,1
228,Ready for this saddenning depressing dullful upsetting dreadful weekend.,0
229,sorry for my lack of tweets  ive been buzy. new vid this saturday!!,0
230," I do my humble best  Going on a works paintball day soon so that should fuel a few strips, no doubt",1
231,going to bed  cant take thiss any longeerr maan. [U],0
232,_Morden ..be at richard`s. if not then i`ll see you when you/we get back  good luck!,1
234,Spent the last hour signing yearbooks. I`ll miss you guys!,0
235,And I just love every little thing about you...,1
239,_Oyler Poor little woman with her smushed in head,0
242, Hey! That`s my school! I hate that place.,0
243, i did i only got 3 stars on the pre wash then failed the rince,0
244,MY SiSTER iN LAW JUST LEFT FOR HER PROM!! SHE LOOKED SOO PRETTY.. TEARS ALL AROUND,1
247,I`m really bored! My brother went to get his permit! Stay off the roads! Jk lol! It feels like all my friends have abandoned me! Except 1,0
248,", goodnight",1
249,"_The_Moon Hiya hun! It`s just not my day. Dentist appointment (ouch!),notebook being a ****. Feeling sick  How`s you?",0
250," but i do emily ahahha you scare me, so it would work",0
256,i think the food i ate made me sick.. i no feel so good,0
258,"Lots of tasks to complete today. First, wecloming new members to Canadamigos Social Networking site, www.canadamigos.com, and coffee",1
259,Just wants to stay in bed all day but has to go to work instead  sux,0
260,chillen trying to figure this thing out gettin drunk,1
262,Filming at a carnival for my music video... It reminds me of the Cherry Festival that I used to go to back home... Ahhh memories...,1
263,I`m siiiiiickkk  I dun feel good!!,0
265,Glorious sunny day in London town.. I`m in drama school fighting people with swords while protecting my romantically structured face,1
266,_89 I feel so sorry for her  hope she dnt cry 2nd time,0
267,would wish the severe migrains would stop!!! doc`s prescriptions arent working,0
268,"09/09 +full moon+ my lovely friends and family= my b-day wish came true;)<3 In addition,gray matters is one of the cutest movies ever!!",1
269,My Life Would Suck Without You - Kelly Clarkson,0
271," you should so host the next logies, i only laughed at your bit really",1
273,__joy i feel like red lea now,1
277,Is miserable  i feel like im gona cry  sux!,0
278, i know they are delicious.miss germany but like holland as well as we used to shoppin there at weekends.lol,1
279," LOL, very true. Maybe next year. I loooved that siggy, and I don`t remember what the password for the mod thing was  Cake?",1
283,Straighening my hair and its not going as straight as i want it to be what a  bummerrr for me,0
284," I need botox work on the lips if I`m going to change my name to Angelina Jolie, but it`s a thought! Sad though about the racism",0
286,Morning all! Have a GREAT DAY! Off to school I go,1
287,"now, in a weird mood  muahaz",0
288, congrats! Photo of dre?,1
289,"#SanctuarySunday  thanks for joining on #SanctuarySunday, follow more Sanctuary people to keep up to date on the tweets!",1
292," Oh, and a very good review",1
293,_MileyCyrus it wont let me do it twitter keeps saying over twitter capacity or something that bird keeps coming up.,0
294,I`m extremely hungry.... and the only thing I have in my house is Soup...  I don`t like soup... *pouts*,0
295, its hilarious,1
296, I love the guy that was standing behind me,1
297,Bout to hit the sack...got **** to do tomorrow. Happy mothers day MOM!,1
298,lost my DC hat ..,0
305, I am soo excited about your pasadena seminar...if only i can find the confermation email,1
306,Ugh I don`t feel well again all of a sudden,0
307,I want a new phone  I`ve seen too much cellphone commercials (,0
308, we`ll test that theory  with no right arm to strum with.  Got a feelin I`ll be humming my new tunes for a while,0
309, http://twitpic.com/4vuuy - That`s so cool.,1
310,school. 39 days !!! so exited. Amazing premier ,1
311,  tis very useful indeed esp. for newbies like me!,1
315,is relaxing after working on Mothers Day.  Oh well. A good day had.  Hope you are all well,1
317, yup!  Now I can join in on the nin access fun!,1
320,Download movie  'A Good Day to Be Black &#38 Sexy' http://tinyurl.com/ckmkul cool #movie,1
321,Jus got back from a run up sunset blvd! My cuzin tried to kill me my legs are still movin and I`m sittin down!!,0
322," Aww, that`s sad.  I miss seeing you guys on the big screen.",0
325, Thank you so much phaoloo !!!!,1
326, the hotel should be thankful,1
327,"Watching GH. I feel so bad for Carly.  OMG, so **** up.",0
330,IS ANYONE AWAKE?!?!?!?! oh my god i am dying here. i want to go to SLEEEEEEEEEEEEEEEEEEEEEEEEEEEEEEEEEEEEEEEEEEEEEEEEEEEEEEEEEEEP. :[,0
333, thanks for following,1
334," Well, good luck then.",1
335,at work getting a quick bite to eat before having to kill my wrist self addressing 500 envolopes,0
338,making german apple slice  nom nom nom,1
340,My tummy hurts,0
345,The poor Pirate had out his last wisdom tooth and is looking really peaky.,0
347,"waiting for aaron to get into town, and then leave him for work. booo",0
351,is going to bed soon. happy mothers day to all the mothers  <333 ryan less than 3 weeks :],1
353, well even with her breakdown she was better than the other acts unfortunately! Britain`s got very little talent,0
355," Sadly, I can`t view that site due to region restrictions",0
356,"It`s 20:50 hs and i`m still at the office...really tired,wanna go home!",0
358,_day26 ~ Awwwww have fun with the fam boo boo,1
360,Mexican coca cola in a bottle. New favorite thing.  No high fructose corn syrup....  sugar is so awesomely old school.,1
361,Got people don`t let me skip sci pratical becos skola is impt and dont waste my parents money.  Nt fair.,0
365, Thanks for the hint.  http://tinyurl.com/chtx7e.,1
366," u welcome babe, kill the show! Yuuupp!",1
368, I was never a good stereotypical teen,0
370, i am so sorry,0
374,i have problems wih pizza..ii love it too much..i`m so addicted to pizza  and Dot Dot Curve. >,1
375,So tired.,0
376,had a lovely breakfast with mum...yummy pancakes,1
377, Yay! have fun,1
378, Why thank you... Us Mami`s are bringin` sexy back...,1
379, lucky! that`s awesome,1
380,"Oh god, a moth was living in a **** power outlet!  (Actually, my PowerSquid.)",0
384,"I love  very much  I called him, but he was talking to other fans  I love you a lot Mitchel! I`ll see u in El Cajon. June 7",1
386,"Woo! Two days till awesome gig, one day till Uni is finished for 12 days  #gigs #3yp",1
390,I`m dreading hearing even worse news tonight,0
392,haappy bank holiday  2 weeeeks. aah!,1
396,says my new layout is so cute x) see the cuties ? hahahah  http://plurk.com/p/suqp6,1
397," Good night, Rob. Sleep well. Safe travels tomorrow!",1
398, i know i suck.  my data plan is weak sauce.,0
401, dear oh dear.....,0
403,playing at my old school playground still the same except them lame **** got rid of the tire swing,0
406," Lol - I could have written that - would be good to have 2 Mondays this week, then I might catch up x",1
408, Cant wait for DTE in Michigan this summer you guys are great look for me in the customized NKOTB Track Jacket,1
411, I love the smell of procrastination in the morning... oder so.,1
412, I considered being a nurse when I was younger but I really don`t think I could cope if a baby died,0
414, Nice!!!!!!!! I WILL be there,1
415,Oh No!!!! I must be gettin old!!!! My mom use to watch this show....I miss her,0
416," lol that just totally made me laugh, which made my day",1
417,tonight was fun,1
419,Good morning!  Just took the longest shower ive ever taken in my life. Like 45 to 50 min shower!! Woah. lol,1
424,"Allergies  sun is out, wearing shorts.  Stuck with my advisory the whole day.... This should be boring. Except fun. If people make it fun?",0
428,Good  morning! Just went to bed it feels and already morning...goes fast! Now i am going to the gym soon. Have a nice day!,1
430,no internet for a week or longer,0
431,Jesus Christ meadowhall could do with better air con! Too hot,0
433, I sure she can,1
438, i want to gooo,1
439,evryone come here http://www.blogtv.com/People/GinaNicole2 were spamming so much and blogtv is glitching and it might work,0
440,Ready for tomorrow. My mommy will get her gift for Mother`s Day. Hope she LOVES it!,1
441,Ugh fun concert  screen cracked on phone again because it fell... =\,0
443,"So happy, my VStudio shortcuts are backkk",1
444, can`t wait to hear the evp! And cuuuute picture.,1
445,Headed to verizon. Praying that pinkberry is going to make it.,1
446,Awaiting reply from two projects. One cancelled.,0
448, Have You Watched You Belong With Me?   By My Lovely Sister ) Kiddin.,1
451,"Well, Sacramento, I hope you appreciate Rivkah Sass & treat her well. I`ll be sitting here in Omaha, pouting",1
452,Leaving the beach .. Having a great day with vicente .. We needed this time together,1
454,just left & already misses Nashville  be back sunday,0
456," you`re a busy Bob, I`m jealous. I`m not sure I can even afford to go meet John de Lancie and Leonard Nimoy",0
457,I am living in a country where the government is ALWAYS a circus show ... sad but true...,0
461, yep  but I`m going better now,1
462,Fun is being had.,1
463,$#@! My nose stud fell out and I can`t find it  Looks like I`ll have to head into Amsterdam today and get a new one,0
465,_other Excellent analogy,1
466,Good morning tweeps. Busy this a.m. but not in a working way,1
468, FOLLOW ME BABY U SAID N DA CHAT U WILL  LUV YA GOODNITE,1
470,got a rad new t-shirt from my aunt. Made from some cool shiny shiny pink material.,1
471, it was an awesome talk  find it very true that i am watching the ruby community closely,1
473, hahaha niene ur soo smart.! lmao i think that is who its by..  good lookin.. whts up gurlie?? i come home this weekend.!,1
475,"I hereby announce that I am... employed! Couldn`t be happier, Alhamdulillah!",1
476,"i juz registered my cp in twitter, but my tweets wont go thru? Argh..Hmm wanna follow my idols lyk  away from the PC..",0
480," Glad to hear you made it out, I hear that place used to be it`s own country  Looking forward to your arrival!",1
485,"TAKE THAT, TAKE THAT!!!! IN YOUR FACES!!!!!!!!!!!!  Robbie won!",1
489,feels ..my cousin is a monkey  http://plurk.com/p/x23pa,0
492,Don`t you hate it when you`re left with one slice of bread left in the bag? Half sandwich.,0
494,"Gha, off to work - hopefully traffic has cleared up by the time I get there!!",1
496,Going to meet the new family I`m babysitting for... Wish I was still sleeeeping,1
497, Hi Heather. I dont know why... but I just saw your messages from April!! Have not been very twitter friendly...,0
500, I know right  Poorpoor girl! It shows why they shouldn`t put young people in competitions like this though (.....) -,0
502," wowie wooie someone updated their twitter without me having to remind you. I`m not even mad,I`m impressed.  how was the lasagna ?",1
503,Today is another good day for some less extreme experiences... Anyone a fan of #24? I`m watching season 4 now,1
505, still not 100%    im sick of being sick!,0
508,with hubby at the dentist ready to hold his hand  and getting nervy about potentially buying a car tomorrow,0
509,Aww I got to see my 1st grade teacher`s last day before she retired,1
510," For sure you should continue to Tweet WHILE on conf call, WHILE worrying about cat and bee.",0
514,"gawww, why is facebook being so slow?",0
515, im cool  cant wait to hear these stories xoxo,1
517,Also I was conviced to do a happy dance and then told it was the most adorable happy dance ever,1
519,i feel in love with pizza girl... now i eat pizza everyday,1
520, 11 30s way early! anyway nigth night  love you!,1
521," If i say PLEASE REPLY TO ME DOUGIE, will you do it? I double dare you",0
524," MUAHAHAHHAHAHA...   well, maybe they think I`m crazy or something. I haven`t scared  yet though",1
526,today got her POP! t-shirt & lovess ittt  haha x,1
528,"Perfect night. Best month of my life so far!! You my boo, ",1
529, yayy  you`ll can help me im doing my english homeworks which i had to do during the holidays >.<,1
531," Think you should do a tour in England, we dont got to see any aweomse people !!",0
534,Is bummed out...i don`t have even one testimonial on Flickr.,0
535, I am sorry that you are feeling that way.,0
536,yeah so Prom Night is now the Craft (good movie),1
540,"    I am sending healthy, healing thoughts in the mumborg`s direction.",1
541,"Not at prom. Ha! Chinese, iced chai, and some old school pokemon. Good night",1
545,Good morning scary world!,0
546,"is back at working auditing away, time to make the hard decisions and be happy",1
547, - ummmm. no comment. LOL. I actually have not watched GH in about a week.,1
552, Thankfully that face only shows up for photoshoots,1
553," Don`t worry, the bizarre will find you",1
554, Sorry - I have failed to grasp your meaning,0
557,Extremely happy to see my new track 'The Awakening' featured on Indivibe   http://www.indivibe.com/vibe.php?city=1,1
559,"I love my mom! Happy Mother`s Day, mommies",1
560,Just Chilling after MCFLY last night! ABSOULUTELY INCREDIBLE! =D i love them!,1
561,"God, why can`t I be at #asylum? Really. I never get to do anything cool!",0
563,"working on mothers day slideshow, cake, card, and balloons  she deserves the best!",1
567," - You too, thanks for completing  Calvin Appreciated",1
568,"Morning everyone sorry for going early last night had bad news, felt totally ****   Today is a new day",0
570, Hahah! That was the best! Thank god for Terry he was laughing so hard. I miss him   I remember racing trucks with him that ...,1
572, KILL IT JASMINE! Haven`t talked to you for ages.,0
576,my apple-mouse doesn`t work on my shiny red coffee table...,0
577," (2) in commentary  , I was with her, was sad, very sad",0
578,Yet another good weekend with someone. Sigh. Man I like the boy..,1
579,"about to head to the Strand, goodnight",1
582," Aw, that stinks, I`m sorry.",0
587,My comp is being slo w,0
591, : Come to VietNam to make a live Show Miley. there are so much fans love you at Viet Nam,1
592," 'You guys could have fun in a cardboard box'.. I miss you already, bro.",0
594,Josie`s out of surgery. She`s now officially unable to procreate. And She`s way out of it... Poor medicated baby,0
595,I signed up for an account on a political website so I could post a comment but it isn`t working.,0
596,_NigerianBoi thanks JT i also enjoyed it i will. r u following me? ill follow u back,1
598, sorry 19/female/atl very lonely,0
599,"Feeling awful, new medication is making me nauseous",0
600, inooo arent they just  i wanna just go down there now an meet kyle again.. im too obsessed its not fair!,0
602," If I could, I`d send California sunshine your way.",1
603,I need a present for my mom.  Could anybody help me ?!,1
604," I am in Weirton Julie, way up North at the tippy top! LOL we don`t think southern WV folks like us too much.",0
606,bad mood and i dont feel good. too bad no one cares,0
607," I love you so much.  Just got into my hiding spot, gonna go check out datalounge",1
609,"  youre diabetic?   so is my dad.  & i might be too, not sure.  are you still allowed to eat sugar throughout the day?",0
610,I just really want to sleep butmy eyes won`t let me,0
613," Ian and I are going to a matinee tomorrow, or that`s the plan at least...it`s going to be too expensive for 3d at night",0
615," I know, but work is so boring. I prefer the  take on life",0
616, Gmorning Hermana! Thank you for your testimonial it is wonderful. Posted already.,1
618,"AHHH - Whatchu talkin� baby?  HAHAHA I can�t believe youu:O heh, actually I can. Life is worth taking risks... http://tumblr.com/xs81qy54s",1
625,Well it would seem that you can enter nine 0s if you are an Individual without a SSN/ITIN or EIN according to Apple.  Hurray!,1
628, oh you are too kind,1
633," man, I am really sorry",0
635,wow.. tomorrow and then it`s over. i`ll never see some of those people again. it`s kind of sad.,0
637," I send messages to greg all the time, no answer  its ok I still love o & a, goog luck with your move to Erie.",1
641,10.11PM~ todays a drag for me. so bored. im about to get into the romance book so i prob wont be on til the morn  night twitter babes ;),0
642,"twitter fam, i`m about to hop back on AIM i went ghost on y`all lolz sowwy",0
643, i make them good girls go bad,0
649,oh yes! Level 40,1
650,my baby`s off on his adventure. 14.5 hours in the car up to Lake Ann Mi. I admit it. I cried a little when the truck pulled out...,0
652,frustrated by my stupid iPhone I need a blackberry!!!!,0
656, Oh! I ate pizza last night too!  I stupidly feel closer to you somehow!,1
657," Oh right,sorry,now i get ya,But still 3000 email`s,wow,cool",0
659, my bad homie,0
661,Good morning everyone,1
662," love this one, especially the shoes  anyway, gmn punya acc lookbook ya? http://lookbook.nu/look/92920",1
665,good morning world,1
670,And ... Happy Mother`s Day to all Moms   You sure are the ? heart of mankind.,1
673, lol that was a great movie,1
678,Hecks yeah. Jandy timsamlake is too rawesome!,1
679,**** internet jus cut me off!  was bout 2 shoot sum guys eye out  ~*~KANDI~*~,0
681,Not only has it broken but it`s Monday!!Does this mean Monday can be fix`d?  ? http://blip.fm/~5jgio,0
682,People at work are stressing me out.,0
686, Lol Your tweets are so funny! I met you in Calgary! You`re awesome  Can`t wait for the next HP movie!,1
687,is off to work ... still 'recovering' from an amazing and beautiful weekend. Have I mentioned how incredible my friends are??,1
688, so`s the smell of cigarettes and alcohol... at least *i * like it.,1
692,`s current goal is to lose 10 pounds by next tuesday! 120 here i come   soooo ready for Gatlinburg!,1
693,my best friends bought something which i really want.,1
702,Bad migrane and need to go to dancing tonight.... Not a good combination,0
703,"Grinding Skyguard rep. This is less awful than I anticipated. Yet, still awful. Last tabard I need",0
704, i dunno if he saw it  happy birthday girl!,1
708, ****! I want to be at the beach in the sun,0
709,OH. I am just so tired.,0
710,"Well, my dog still isn`t at the shelter. I hope someone good has him",1
711, Well tell me what fashion tips you need and I`m your woman  hehehe,1
712," Hello there, Taylor  I MISS YOU. Its been 2 months </3",0
713,i wear a lot of white  http://tinyurl.com/dlbltg,0
714, Always a good idea.,1
720,All of a sudden I`m craving broccoli and cheese soup really bad... my mouth is watering envisioning a bread bowl in my head...,0
723,"Wish you were here, babe",1
724,This morning I rode behind a guy with a bird cage containing a plastic Tyrannosaurus rex attached to his bicycle. I couldn`t get a photo.,0
727,"morning, how is everone? sing to me  You tuck me in, Turn out the light, kept me safe and sound at night. (8)",1
728,i so can`t be bothered working tomorrow!,1
729, kittens are cute then they grow up n become CATS,1
730, .. Guess ol` Tom has another mission impossible ... some of this is like trying to prove innocence .. I didn`t get hugged,0
732, gawd. People still remember the preggers comment. Hate you!,0
733,oh no my tweetdeck is malfunctioning :O il have web will its fixd,0
