742, Awwww   i`ve got some photos of cute bunnies,1
743,long day and i still have to mow the lawn,0
745, why has it been so long since i have talked to you let alone seen you?? it makes me sad,0
746,Happy mothers day mom  ?,1
747,I want cookies for breakfast! Luckily I`m an adult and can do that!,1
748,Mowing #6. I hate my lawn,0
750, yeah.. I left cause my pc can`t run the client anymore. I had thought I would have a new one by now..,0
751,Feeling bad for  profile pic,0
753,movie then sleep! Today was good day  [{H!--D3ff}],1
759,is getting married in Vegas in November by an Elvis impersonator am so happy!!!,1
763,Their songs make me want to cry..,0
764,While driving u come across aggressive driving behaviour by another driver. U should... Chase the car 2 tell the driver how to drive,0
767, Wasn`**** totally awesome?  Seeing the rebooted crew was so nice!,1
768,"_d thats good to know, and I bet he looks just like you.",1
770,i so wish i could get pregnant!!,1
771, im trying to fix it.. it doesnt do it  and its 'ahi dios mio' but u did good lol,1
772, Hiya! Missed you too! What have you been up to?,0
774,Really sick,0
777, thanks JK!!!  Love ya to death,1
778,Going to Al Ain.  Need to check out one store. Hope i find things that I`m looking for.,1
780,So my parents are too busy making me feel like **** to realise that I`ve got worse and need to see a doctor again. No sleep sucks,0
781," G`night Jonathan! I tried to stay up, I really did. I can`t wait till ur in my timezone! Will be so much easier then!",1
782,Prom is so over rated!! Irritated... Going to bed goodnight,0
786," english screwed up my overall percentage in X, in XII again and probably in adm tests too. **** happens.",0
787, i want chinese food really baaad.,1
791, ha! lemme know what you find (tho I suspect it will be a lot of complaints). Have a peaceful night my friend,1
793,  sad face.,0
794,Aaaaahhhh.... Friday!!!! but.......     Funeral at 5,0
795,Already misses ,0
796,"_laura_LP ok thanks for the help! I hope they respond to me sooner or later, then! thanks!",1
797,  out of commish for a few days in ATL with fam.  Just saw the updates to the .net website... Looks AWESOME!,1
800, I would vote for you Miley but I live in Ireland  You`ll be fine  Good luck! Sl�n!(bye in irish ) Sorcha xxxx,1
802,"Oh..Summer begins..yay..  The fighting, Crying and stress has started with the kids..It`s only been 3 hrs since they got out.",0
803,I feel so deflated. No more doggy.,0
805, Omg really??  I sowwy! I`ll do it again! :-p I was tired when I did that this morning. :-p lol!,0
808,Making my boyfriend look different.  He`s  cute no matter what. <3,1
809, LOL thx,1
816, i`m not in the best financial situation myself at the moment. i`m beyond broke. my money is spend as soon as i earn it atm,0
821, i wish i wasn`t all  bummed but i kinda am,1
822, Hey Mitchel when will you be live again? I didn`t get a chance to call you,0
824,Back is SORE... should not have done that jump last night,0
826,'Brides a la mode' pow wow first thing this morning   This past weekend`s lovely wedding fresh in my mind... pics soon!,1
831,"such beautiful weather.. .why are u sick, baby ?  @ tanapolis",1
839, Yep. Nothing to worry about.,1
840,back to work tomorrow  whose idea was it to go back on a saturday?!? Oh wait... that would be mine. FAIL.,0
844,Wow what a storm we just had!!! Now no power,1
845,getting my phone back this week  yeeeewww,1
846,back from school  daily show was amazing  gonna watch it again later i think xD,1
847,_breez Yer please do! Have a good day!,1
849, hot cuppa coffee made with milk & fortified with Monin`s Irish Coffee syrup! Bliss!,1
850,right im out of here peeps.. i hope  fixes twitter mobile so i can tweet from the race.. m.twitter has been down for 4 days  #fail,1
853,productive day 1,1
855, gotta love the summer,1
859,_buckley Good morning from sunny London...sounds like an oxymoron but happens to be true of today  Hurrah!,1
860, Cool. That`d be fantastic!,1
865, srry im not so interesting right now... stayed up til 6am cause my tummy hurt and now im pooped and have to work,0
866, me because I might not have enough money for college!!!,0
868,I love how when I leave my laptop on my bed it creates a nice toasty spot,1
870, Does it start tomorrow?  I was going to book Sam on that and forgot,0
871," salt and vinegar, cheese and onion make your breathe smell lol  ****",0
872, You`re welcome. There!  I added you already!,1
874," Sorry to hear about your dude probs, what is it that`s too much?",0
876,"maybe i should take up drinking again, feel as if i have a ,massive hangover  still not ,yself today",0
878,TODAY FRIDAY: I really hope you will read my messages here and reply to me soon. I could not reach you by phone before you go to work.,1
879, whatever i know you like it.  HAHAHHAH!,1
881,Good morning twitterland. Happy Monday,1
883,thanks timmy.  turns out he has strep and a high fever.,1
884," oh, that is very nice!! I will do something nice next week ~ going to Madrid next weekend for few days",1
885,keeping it chilled.,1
886,what a beautiful day not to got to my first class,1
887, Fabulous. And I didn`t get that pic  Gmail be acting the fool sometimes. Can u DM me it?,1
889,_ that sucks!,0
890, yes it does,1
891,_datti Thanks sankar for ur wishes,1
893," sorry bout the cat,",0
895,Up and washed  I`m clothing myself as I type xD WOOOO,1
897, love love love pot psycology. My Friday night treat,1
898,Happy Star Wars Day  May the fourth be with you!,1
900,_art That would be the one.  It`s awesome sauce.,1
902," I`ve never been to Prague, but if i had the money, it`ll be in the 10 first cities I visit",1
905,"_ really!? that son of a ****, screw him, ill talk to on msn later k  xox",0
909, don`t follow me. You will ruin my twitter experience,0
910,Blah to car repairs... almost 600 dollars...   Shopping around for a better deal.,0
911,Weetabix and Choco milk  Yum!,1
913,I`m sad to have lost another person close to me to cancer,0
915,_Nutbar Good morning  how are you? #TwitterTakeover,1
918,"_la ben`s dreams make me so saddddddd  i want them to be togetherrr. i swear if this **** gets me bawlinggg, so help me..",0
922,this weather makes my fingers numb / still waiting,0
923, LOL yeah ima mama  thanks. happy mama`s day and lakers day! i love it!,1
926,http://yfrog.com/0xoxij Fry bread is good but they only gave me a little pinch of lettuce  ha ha,1
927, Its WoW! effect  Thanks for the update.,1
928,"got up at 8 today, and also misses his friend ",0
933,Gonna go to work with my honey today!!!! So exciting!!!,1
934,_ aww thats too bad you lost it though,0
936,I hate going online and looking at the balance in the bank.  its always a lot lower than I need it to be.,0
938,_x How did your Geo ISU go? I swear I just had the worse day ever..,0
939,"And you could have it all, my empire of dirt! I`m in a&e with dad I`m freezing fully shivering Every1 else is warm  no fones allowed ffs!",0
942,Out for ultimate training. looking forward to the sunset!,1
943,going to work once again. what a great few days off i had. now it`s over  but atleast i get 2 more commin up wahooooooo,1
949, I broke my ipod,0
950,_banks 'Something must be wrong. Only found 17 July Harl/Sil books I wanted,0
951, Haha and you should! State pride is important,1
952," Ugh, did you just say your friend might have swine flu? OMG, why?",0
953," haha no problem, it`s fun isn`****",1
954,"Finally got to wash my hair! I feel much better now, but I gotta dry it ... Effffffort.",1
955,finally feel back into swing of things here at work after getting married last week! sigh of relief for no more wedding planning!,1
956, that sucks  booo.,0
960, oh ****!!,0
961, i dont really trust the judgements and vouches of _xo   jk. i`ll think about becoming a friend of yours,0
962, Jesus heals,1
969, Happy birthday in 2 hours and 54 minuets  Haha,1
972, Hayley Williams is pretty much amazzing,1
976, not really having a good night... missing my little girl...,0
977,  miss you captain,0
979," OI, are you mocking the fact I dont cry at tv things?!  *Feels bad*xxx",0
988,is excited!  http://plurk.com/p/stk04,1
989, hmmm really??? that`s weird idk about that one  sowwy,0
993, Thanks though - am trying to be positive!!  Wine may not be helping lol!!  Wish I could make the gigs.....,1
994, i think my niece got me sickee  lame.,0
995,Rise and shine  Time to get prettifide.,1
996," I tried sooooo hard to work from home today, but failed  Not my fault though.",0
997, Gosh I`ve a stinky old headache. Maybe I should have lunchfast,0
1001,I love my life  Ni night twitter!<3,1
1003,Succesfully following Tayla!!,1
1007,trying to learn to tweet!!  it`s all good I hope..,1
1009,"Great, social network sites are still growing",1
1015,some of my new followers are pretty cool tweeps; check `em out.,1
1019, yay asap lol awwh I miss our friday night happy hours even luna del sea and the 'boy' hahahaha,0
1021, Cowboy westerns...haven`t seen those in a while. good luck,1
1025,My dad knows i got drunk today. And i didnt get in trouble.,1
1027," Lol - I could try!  Seriously tho, dont do all of it! That sucks! ****",0
1029,Happy mothers day mom!!!  i love you.,1
1030,"burning cd`s,,,,,,,,, **** outa blank disc`s",1
1031," new album is truly genius, so happy with it",1
1033, Okaii Cool!  I Can`t Wait For The Series To Begin It`s Guna Be Awesome  x,1
1034,crying to A Walk To Remember as usual,0
1037,"I also have a certain CD from camp that a certain somebody gave me...  Yeah, there`s this guy in the video that`s really frickin hot!",1
1047, http://twitpic.com/4l85a - best kind of gum ever! I just bought a pack,1
1048,The Heater blew up,0
1049, i tried. and failed,0
1050,"  just finished mine, some parts were remarkably difficult  cramming kanji now!",0
1051,why is everyones tweets about britains got talent?! i feel left out,0
1052,yay mothers day  i love mi madre,1
1053,They wouldn`t reverse any of my overdraft fees.,0
1054,_N9ne I`m not having a good day,0
1055,i miss the Soulja Boy dance...,0
1056,"I woke up an came to the realization that I can put it off as much as I want, but I need 2 drop some friends. Dammit!",0
1057,11 Days left until freedom. I really just want to get through this weekend. I hate essays.,0
1058,  lol you guys are awesome,1
1059,"Home, good night world",1
1061,got alot of runnin around to do today to get this job app completed so they can have it on file... so glad i got this job!!,1
1062,lappy charger is completely dead... conserving what`s left of the battery until i can afford to buy a new one,0
1064,Happy Mother`s Day all of the mom`s around the world!  I love mine more than anything in the world and can`t wait to celebrate! WOO!,1
1066,doing my folio work but keep on getting distracted by deb pics,0
1068,I can`t sleep. I can`t find my grandmother`s quilt or locket. I`m sick at myself cause I may have lost them somehow. Or they were stolen,0
1069,Had to take my bad **** dog to the pet hotel....so sad,0
1073,"Wow, its hot and miserable. People are probably killing themselves right about now...",0
1074, Thanks mama ! I absolutely adore her,1
1078," i would but he`s premiering avatar footage and can`t do it then. also, we better hang out.",1
1079,Home from Chelsea`s  Jam sessions = <3 = Chelsea + Abby = I luh you.,1
1080,we`ll be visiting my grandparents later. BTW i just heard katy perry`s HOOK UP whew so cool i love it more than k.clarkson`s version,1
1081,"  very sweet!!! HAHA. I am like super proud to be a new mom!!! I feel like, i got the PERFECT daughter. And i am a GREAT mom!!!",1
1089," you should come to Estonia, I know some epic horses here, hehe, and a good trainer and good beaches were to ride!",1
1090,_jonas101 WOW they`re totally amazing and they`re more than awesome,1
1093,"nothing better than to have your Grandaughter smile and nothing feels better than that big hug!! Grandkids, what a hoot!",1
1095, oh I know. and I aprreciate it  it can be my back up plan,1
1102,"Don`t think I`m gonna be able to go to see the JB 3D Concert...wrong time, no where very close by",0
1103,"I`m a sad panda, hulu doesn`t have the elephant show   no Skinnamarinkydinkydink sing alongs for me.",0
1106,I`m gonna cry    I went bad at my History test ! I really hate History  !,0
1110,_ Truetrue  But he`s not! xD,1
1111,"Sad I missed  going away party due to too much work, but I really am gonna miss that kid",0
1113,One of the most random phone calls ever. My god kill me now.,0
1114,& more #<3criminy cuteness! http://tinyurl.com/cd8yab #sinfest,1
1115,"the neighborhood gas station is gone, kaput, out of business. No more convenient trips for ice or whatevs. over 3 miles now to travel..",0
1116,tomorrow`s mother`s day  me n my sis gonna make an onigiri for our mom~!! its gonna be so kewl!! cant wait for tomorrow >_<,1
1119, welcome to my life,1
1120," Same here - events + writing songs. But I just finished my TMNT vs MMPR song, so I`m excited to record that on Wednesday",1
1122, oh sweet! I`ll definitely check it out when I get the chance...,1
1123, Youuuu`re an aaass  my aaass loooool,0
1128," I missed mine, too. Not fun...",0
1132,Danny cut his beautiful curls,0
1133,God is so good!!,1
1134,forcing myself to watch the movie 1984 for my book report  im lazy to read,0
1136, don`t think i can take a needle. watched a horribly gory short film on drugs a few months ago. i`m scarred for life.,0
1139,can`t be arsed to get out of bed  hello sunshine,0
1140,Every pair of jeans I own nowadays is very tight.  I think mah butt gettin big (oh!),0
1145, Cheese and Onion! Vinegar taste weird on crisps! England`s got loads of weird crisps flavorus  lol.. What do you like ? x,0
1146, Thank yooou! I might have to get it seen to... hm...  ****,1
1148,Sore throat. This is not good. I have four performances this weekend.,0
1149, it because your handwriting isnt on any of them. and everyone is making fun of me because im sitting by myseld in the lrc,0
1150,So disappointed about the talent lineup for 'Revent�n Super Estrella 2009'...hmm...Have the feeling I won`t get tix this time around.,0
1153, how crappy for him,0
1154,its freezing cold! i cant function right in this type of weather. starving to the max,0
1155,Anyone ever had that heavy feeling of sadness in their hearts? Thats my case rite now.,0
1160," aww if I could, I would...  GBY ;)",1
1161,I ate too many kisses.,0
1162, Thanks for the warning. Good thing my heart is unbreakable.,1
1164, ... like you`re stuff!  Strange voicemails! http://bit.ly/yKxms,1
1165, Well done! Happy for ya.,1
1169,"True to form, Bank Holiday Monday looks like it might be rainy. Hope it holds off til later, family&friends plan walk and picnic today",1
1172,"Ha,  i`m giving spymaster a chance - just curious! will miss u",0
1175,is tired. And turning off the Internet. You can play on it in the morning.,0
1177,happy star wars day,1
1178,Just got notified my podcast was accepted into iTunes. http://budurl.com/SBit Of course I then realized it was miss formated  Fixed now.,0
1179,Heyy.thnxx.or.inviting.me.to.ur.party.rob.ill.be.down.there.on.june.24th.ill.miss.u.when.u.go.to.italy....   <333333333 txt.me.hon!!!,1
1180,is tired of summer already,0
1182, I`ve given up on pizza - kids would never let me have my fav  (the hot ones),0
1183,im hangin out with my cousin holly and tlkin 2 my grandparents.......  my phone went dead,0
1184, Thats great,1
1186,i wish i could teach my dog how to play xbox!  alas...no thumbs,0
1188, thanks! I`m totally bushed today though time for some coding,1
1192,Omg!!! Is this the sun glimpsing through the clouds?! Woohoo!,1
1193," haha yea, i just feel like its being taken the wrong direction, used to be a cool place, now its a mess",0
1194, shes must be a truly amazing woman for having a phenomenal son..,1
1199," umm get ready, help my mum, give GJ his presents when he gets up (could be a while), wait for people to arrive, then party",1
1202,Happy Mother`s Day mom,1
1205,"church bellss are ringin  got to go. adieu,(god bless in german)",1
1208,did U watch the spelling bee contest ? winner: Kavya Shivshankar ! Impressive performance - i had not even heared most of the words b4,1
1209, probably not in this weather,0
1212, no wonder you hate driving and country roads and stuff,0
1214,says HAPPY MOTHER`S DAY TO ALL THE MOMS OUT THERE!  http://plurk.com/p/stezd,1
1217,sad.. Daniel is leaving Florida now.. just gave him a big hug,0
1218,it`s mother`s day...i already bought and gave my mother`s day present to my mother.,1
1219,Best friend is leaving to go back to school today..I am so sad,0
1222,has a new nick name - arosh ..i like i like,1
1232, i guess you get loads of emails & people asking you stuff al the time but i seriously wonder if you ever read my comments  x,0
1234,Ahh... I love Chinese music. Haha.  Not gonna see my luff til Thursday...,1
1235,People are people...nooooo? Id never have guessed tht...idiot..im grouchy now,0
1236, i see you hannah klein!. lookin good today,1
1237,aha _marie my brother`s wallpaper on his phone is Dolly The Sheep  aha i`m loling.,1
1243,Mudweight hauled in for last time by   http://yfrog.com/0zr2jqj,0
1246,"Barack Obama is a legend, just watched his dinner speach, it was pretty funny",1
1248, Ouch. I won`t be down in Miami tomorrow morning. That sucks  It`s a cruise? Are you driving back the next Saturday?,0
1249,sadd..  last night in fl.. going back to AR tomorrow,0
1251, sounds awesome..,1
1253, no. my school will start on June1.  two days to go. i still don`t want. :l,0
1257,This month was a bad month to try and get an advert together for Kobold Quarterly,0
1258, I`m concerned for that family,1
1259,Idk i cant do ****,0
1260,only gets spam in her college email account now. What a way to rub in graduation.,0
1261, I`m very much in tune with your words today. Thanks.,1
1272,putting 3 new consultants to work this week. it`s a good feeling!  congrats on your offers,1
1277,FRIDAY so freakin happy today was an annoying day  buuut WEEKEND! TGIF<3,1
1278, YEP  it`ll be awesome to the max =] haha,1
1279,"_ Heading off to Poole around 4ish,  has some serious gardening to do before we go, no Tweetdeck til Sunday evening,",0
1281,Have to go to the dreaded DMV tomorrow,0
1282,"Is on her way to nottingham! ICOF tonight, then no more gigs umtil download. Fail",0
1285, Hey! r u back in La right now?What was ur favorite part bout Europe? I`ve never been out of the country xcept Canada  XO Jenna,0
1287, I wish I could have time for my xbox  project all tied,1
1290, Yay I love it when you host Money For Breakfast Jenna Lee  4hrs of you the amazing and so pretty and sexy Jenna Lee yay.,1
1291,Gutted. The kitchen is empty literally EMPTY. No even kidding. I`m so hungry,0
1295,"  poor you lmao, just stick your head out the window!",0
1297, dohh! is it old? I had never heard it.. I`m so last year..,0
1298, Instrumentalists like to give singers a hard time. But the vocalist`s job is the toughest when he/she is sick.,0
1299,Just got the Nashville IHOP staff to hit the Dougie with me and Mayne. What a **** night,1
1300,I miss matt today,0
1305,my stomach hurts,0
1306, good luck in the pressure test! don`t worry everything will be great,1
1307, I really wish I could,1
1308,I`m very conflicted here.  I really like Mike but I still have feelings for Darrin.  It`s really complicated.  I don`t know what to do.,0
1311, noticed that yesterday too...i`m actually really happy about that  #StarTrek,1
1313,"Okay so yesterday was good went food shopping, cooked some chicken tacos and bakes some cookies!!!  Now I am back at work.",1
1314,Looking at our photo shoot pics...check out our myspace pics to see them...i love them all...,1
1316,"little beetle not feeling any love  Searches are bring up zilch, bar 2 peeps that appear funny !!!",1
1317," Thank ye, Vaneta.  Much appreciated",1
1322, Quite a few. Peacocks and Oceanographer`s Choice are my new favorites to play,1
1325,ugh! nothing to do in the valley  Seriously gotta move out of here!!!,0
1330,"28deg C in here, all this tech in my room does have the major downside of a lot of heat, doesn`t help its hot outside 2",0
1334,"_leigh Thank you,!  Just trying to stay in a positive head space to keep pushing through it all. How`s things at your end?",1
1336,"Enjoyed this week off work, back next week",1
1339,Feeling very tierd! too much college work!!!!!!,0
1340,mmm...reconsituted meat products and week-old veggies...gotta love that rehydrated warm milk for breakfast,1
1341, oh no  say it aint so,0
1344,"  Cant Thank YOu Enough, WHo is NITIN BETWEEN?",1
1346, well piss on that. I can`t get into their site @ work nor does it come thru on my phone.,0
1347,http://twitpic.com/670ar - this is post guitar hero **** kicking,0
1352,"I need some motivation in my life, oh and some love would be nice too",1
1353, welcome,1
1354,"I can`t wait to start my weekend. I`m so sick of working, I have to self-medicate, and I`m fresh out of herb",0
1355,_Itx no credits for me unfortunately!,0
1356," It`s ugly and gray outside even in San Diego. Not too cold, will get to 70, but May-gray June-gloom for us all",0
1358,cookies are good,1
1359," He loved it, so Happy Birthday!!!   He said you sounded like a mixture of John Lennon, Chrissie Hynde, and Janis Joplin.",1
1361,  supporting superfly all the way,1
1362," I would lime them. Or lemon?  And deal, sounds fabulous to me!  Text me up when you`re back",1
1363,Why don`t you make me feel like you used to,0
1368, unfortunately I didn`t leave the house in time,0
1373,"Hey, hey, happy mother`s day!  http://plurk.com/p/svwii",1
1377,mothers day...love you madre   chels tonight. cant wait for her to see her present!,1
1381, FUZE was giving away capes at Komen`s Race for the Cure today! And I`d always love a hug from you hun!,1
1384,The lab informs me the logic board is dead as well. It is farking expensive to replace. I don`t know what to do.  #MyPowerBookG4RIP,0
1385,We just hit 10000 views on myspace! Thanks everyone!,1
1389,I`m not ready for my baby to be 3 tomorrow  she is growing so fast....,1
1394,lao mein and spanikopita HAHA you would have to be here to know,1
1398,goodmorning everyone,1
1401,"Long day of dancin, travelin, and celebrating life  happy mothers day!!",1
1403, I want an invite - sick of seeing all these links for people playing and being left out,0
1405,I miss my puppy,0
1410,">>Why did the Blonde Keep failing her drivers license test-------->>>>>Everytime they stopped, she jumped in the back seat.",0
1411, Come to Rochester with me and Nikki. Beer and a Hog Roast always helps.,1
1412,  Thank you!,1
1415,He put a **** mohawk in my son head.....he just killed my vibe as always,0
1417,No kickboxing classes today  pretty bummed. Still going to work out hard. http://myloc.me/1ZT0,0
1418,all alone for the weekend!,0
1420,Poor dead Josh.  http://bit.ly/JKpHn  Please leave your messages of condolences there.  #boy #rip,0
1424,This is how much hair falls off everytime I shower. It`s more sad than disgusting  http://yfrog.com/6p190aj,0
1425,"pff, Life sucks sometimes!",0
1429,"Waaah, asshat at CVS yesterday shortchanged me  I paid 10$ for chips.",0
1430, Happy Mom`s Day!  Here in Spain it was last Sunday!! Any hint of when the first single will be out on radio? LYM!!  Mini,1
1432, not sexy with 2 tubes sticking out of my stomach  but thanks !,1
1434,listening to David Archuleta album it`s amazing,1
1435, aww...thats a bummer,0
1436,I dont wanna im to spanish today,0
1439,"yep, good morning to you all  or night or evening or whatever xD",1
1440,WORKK! yay,1
1443," Aww, thank you Soulmate! Haha.",1
1444,"cars,,,,cars....cars.....I need one. ha ha. The one I found last night, that I wanted so bad! is now sold. And not to me",0
1446,_za thanks man. I can`t wait,1
1449,I`ve been to Best Buy & Target and still no Electrik Red album! I`m loosing hope..they`ve never even heard of the girls,0
1450," i was sent home yest from work, when in again today but feel like hell and burning up with a high temp, got it off hubby",0
1451,Great exercise for a Sunday morning: 'stopping the wheel of karma' (R.A.W.) and transforming negativity into love... Life!,1
1453, yes yes yes lotsa fun  i cant wait. dont like make up with shaun too much in front of me tho cos ill get awkard haha,1
1455, Thank you Kirst - your posts on running inspired me,1
1456,I wanna crawl under my desk and take a nap  nvrmind its dirty =/,0
1458,okay someplease save me!!! now I am watching ninja warrier and eating an egg roll from last night,0
1460,HAPPY MOTHERS DAY 2 ME,1
1462, Excellent point.,1
1468,OMG sore shoulder,0
1469, You`re welcome! Cutie-pie kiddo.. in your picture btw  Love those shades!,1
1472, lmao you witty wacko...loves it,1
1473," I refuse to get excited as I don`t want to be let down  if it happens, as long as it`s not between June 11 - 28 or I`d die",0
1474,"`If I don`t believe in Him, why would He believe in me?` -Bring Me The Horizon  A chill goes down my spine whenever I hear that line.",0
1475,"@_xotashhh I love having days off school, I had one on friday too",1
1476, u never sent me carrie. ur an ****. but an **** that i miss,0
1480,sick n tired of people who steal other people`s work,0
1484," #warmfuzzies to you, my friend",1
1485,@_supernatural_ http://twitpic.com/66l83 - I really miss her.,0
1486,happy sunday all,1
1487, Please let me know if it is allright DE i need to know but first just wake up a little and enjoy the cofee  ****,1
1488, well maybe someone will care,1
1489,"   Awww, that wasn`t very nice.",0
1490,slaving away at work,0
1493, haha i agree ! i am her test dummy. i just go in and say 'do whatever you want' and i always love it.  she is magic!,1
1494," ****, i dont have 2 work saturday, & i was suppose 2 hang out with my friend & watch it. we can still hang out but no JONAS =",0
1498, OOO YUK !! thats not good Im retching as we tweet,0
