1499, 120mm films usually handled at Fuji  Oh I met a girl at San Diego. Kwento soon. I miss youuu!,0
1502, Hearing that my songs brighten someone`s day always makes ME grin.,1
1506,Hates having broken wrist and has PE next ugh,0
1507,watching SNL with guess Justin Timberlake...OMG! He is too funny!  hahahah,1
1511,Well off 2 bed...cant wait 2 party 4 Mother`s Day in like 14 hours or so,1
1515,#bouvierb-day is on trending topics. ahh Happy Birthday Pierre Bouvier,1
1516,http://skipall.com/8p.png  The come apart easy enough,1
1517,sadly  brother told me there are no skateparks where he lives. BUMMER!,0
1519,Heaos keen for next weekend.        Mummy. <3,1
1520,i hate stupid boys! arrgh,0
1522, I hope you didn`t take that quote personally!! I`ve been throwing them out here and there all day-guess I shoulda waited a bit,0
1524, sounds like you`re having a great time,1
1528," and Im just going into work... if we were married, we wud never see each other",0
1532,Amazing day with my boyfriend. He`s a good drummer.,1
1533, pansy  wtf codeh?!,0
1534,I should have know that 'extra hand' comment would cause trouble...  About to upload House Music and Beyond Vol. 3,0
1536,Just got back from a run & I`m feeling grrrrrreeeeeaat!!!,1
1538, yes  and i want you to keep going if you would ;),1
1539,Sunburn ouch,0
1540, Fun times ~ that`s my friends beer!  here`s the pic`  http://yfrog.com/053agj,1
1542,The graduation ceremony should be starting about now. I really wish I could be there.,1
1544,- I LOVE YOU!!!! YOU MAKE ME SO HAPPY!!!!,1
1545, Thanks for sending the link.,1
1548,_Hodges Yup. Their loss.,0
1549,i`m sad...i`ll miss you grandma angie.. you were always like a 3rd grandma to me..,0
1551,_in_love scanton?! that`s farrr  elaine got her cartilage pierced! it`s so cute!,1
1552,Wake Up..... Please.,0
1553," Would applaud self-validation for all sorts of good theological, psychological & sociological reasons. But agree - lighten up!",1
1555, im sorry,0
1557, lol exams i didn`t go to mcast or other school i finished form 5 and that`s it soo disappointed in myself,0
1558,These messages are teasing me! It isnt fair.,0
1561, ack! I just read about your show  that`s horrible!!! No accounting for taste.,0
1562," ... thx for ur msg, so awesome!  luv the new single! xoxo",1
1564, last week  and I interviewed  and we told him you are the FB queen! Glad to see you both connected,1
1569,5500 words and counting.  My hands hurt,0
1573, Hi x Your websites soo cool i love using it  Thank you,1
1576,OMggg. i just heard someone is gonna die on the new season of the secret life of the american teenager  noooo.,0
1578,i`m getting ready for tonight (teachers dinner on the beach!) but it`s raining and i hate this!,0
1583,I wish I can see clips of your show that you hosted. Hottie Shawn in the 80`s! and yes your still a Hottie!,1
1584,But on the bright side...no school,1
1587,I have turned into a fast food ****,0
1588,I hate not getting e-mail`s  going to do other stuff now...ice my toe (long story) and have some calpol (cold :S) soooo night xxxx,0
1591,Now I am depressed after watching so you think you can dance,0
1594,misses Nanny.,0
1599,thinks castles are fun,1
1602,I will move anywhere as long as it has a freaking dishwasher! I despise doing dishes,0
1603," Im doing ok.  I have a 15 year old going on 35 that is driving me crazy, but that comes with the territory, I guess.",0
1604,Poor Kella is on meds now for an ear infection; she lost her food all over  twice at the doc`s,0
1605," Yes, have to be right for church",1
1608,hm...still workin on my contract.hmm...i`m feelin awful..,0
1609,I totally forgot my phone at home this morning,0
1610, Proud 17-year-old here that loves The Carpenters!!!,1
1611,feels sick to my stomach and idkk whyy,0
1613, so cute you twitting in potuguese!,1
1616, ew.  sorry zach,0
1618, http://twitpic.com/4jber - aww .... then we wonder why they hate us later..... lol!!,0
1620,i hate it when my bff is groundedd  boooooooooo,0
1621," The Star Trek in IMAX wasn`t in 3D, but it was huge on the screen.  Still worth watching.",1
1623,getting ready to see my cousins graduate.  gonna miss em.,0
1624, **** i shouldnt have left!,0
1626,_law_rence &  WHY?! my head feels like the surface of the sun  underneath a beaver pelt.,0
1635," I love the site what a hoot, really enjoy the hair cuts in Thailand, always try to time ir just right, thanks for the tip",1
1636,Not made it to work  couldn`t get up feelin blurgh,0
1639,My throat hurts and I can`t sleep.,0
1643,The rain outside motivates me to sleep.,1
1648,"hmmm dollhouse sounds pretty good, http://bit.ly/z3aZv  i think ima download it and try watching it",1
1650,"**** these nig*s is all on me, but they won`t get this...'Not without a check!' LMFAO",0
1652,thanks do the invite though,1
1655," Please send me those youtube links, Erin watched most of them but I was cooking and didn`t get to see the cowboys",0
1656," That didn`t work, unfortunately.",0
1658,get it right! I think I am obsessed with Hydes` voice @_@  I`ve chosen a guitar song to learn for the summer! Time to perfect picking!,1
1662,What`s worse than a fever and sore throat? Cancelling a trip to see your little bro because of a fever and sore throat.,0
1666,Yea!  Headed home to change and head over to Pelham.  Sad thought... suposed to be heading over there for the NKOTB concert...,0
1668, Aw it says the pic doesn`t exist anymore,0
1671,my newsreader is filling up with blogs  yay! keep pm`ing me your blog sites. I love reading them!,1
1673,home alone and no one left me any gummy bears,0
1674,back from melly`s party... i had fun...  i`m sleepy now...,1
1675, Haha...YAY!!! I`M CURED!!!!,1
1678,"Sick, sick, sick. This sucks. i can`t even breathe properly",0
1679,Adding names to my Twitter account and learning how to use this amazing thing!,1
1680, ooh thats an early start  ive got bed planned for that time..ha..LoveYouJonesy ****,1
1682,Booo my best friend is leavin for the weekend. What ever will I do without her??,0
1685," Hey, did his wife die? I am really confused. I hadn`t been on his MySpace in a little while, but I just read his Twit.",0
1686,i am kind of excited to go to school today. i dont know why. hopefully it will be a good day,1
1690,"My friend ..has cancelled on me for tomorrow, Now i have nothing to do...this makes me sad...  xxxxxx",0
1691,UGH BUT I N33D T0G0 BAD..,0
1692, Are y`all coming out today??? We could go to the graveyard!!  HOORAYY!!!!!,1
1694, unfortunately I`m not drunk enough lol and have no money to get drunk  I have had alot though as u can imagine haha,0
1696,tonight was a very bad night,0
1698,all mom`s in the world congratulations,1
1699," but better hurry, so you wouldn`t be labeled as copycats",1
1701, welcome to twitter my friend,1
1702,at    Happy mother`s dayyy Deniseee <3,1
1703,"Ben & Jerry`s fail. Got email for free ice cream. Says click here to redeem coupon. When I click, I get error message  ",0
1704,"has anyone else seen this? the  DM notification email says 'reply on we web.' i am all for cool accents, but it`s weird online",0
1705,"YAYAYYAYAYAY Toy Story 3 is coming out. June 18, 2010 though",1
1706, I`m straining to hear but it`s very hard from all the way over here.,0
1707, awwwh u stuck in traffic  booo!,0
1708," Fear not! You deserve alot, you care for animals. )) I`ll get some food, don`t worry!",1
1709,living it up at empire hotel...free bottle service. it ROCKS having connections,1
1711," same to you bud. Kudos on your hardcore gym training, it`s a great lifechanging experience, keep it up!!!",1
1713,I still miss him... And i dont think he`s coming back,0
1717,I got the new Silverstein CD. aha. Its AMAZING.  I highly recomend it.,1
1721," A big welcome to Twitterlandz grrl! Really wish I could have made it to the Bettie show,  glad to hear it was a success",1
1725, plus I just deposited tax return cheque but for first time in 7+ years it didn`t clear immediately,0
1728,"Still feeling weird about my ex and her engagement.  My mom made things worse.  I don`t even want her, but it`s still odd",0
1731, Shop smart.  Shop S Mart.,1
1733, That is INCREDIBLY sweet!!!! What a good Hubby...,1
1734, caught tweets on it and got home in time for the last 5 mins of the ITV2 show!! #bgt Out tonight too so will miss it again,0
1738,Oh my god. I literally drove in rain that was so hard that i couldn`t see in front of me. I`m shaking,0
1742, Good to hear... several of my peeps are working tonight...,1
1743, I hope so too.  How are you?,1
1746,"Just saw Star Trek! It was AMAZING! Seriously, so good. The entire cast was excellent, Spock and Kirk especially.  I want to see it again.",1
1747, aww  but we miss you here in the USA.,0
1748,Its seriously quiet and lonely here without Bunny,0
1758,So sad I`m going to miss seeing Pennywise again this year,0
1766, Even IE8 would be better,1
1769, she lookd soo freaked out!!poor wee thing,0
1770,omgoodness FINALLY back from dinner with the fam bam!,1
1772,"is happy  and clean, squeaky clean",1
1775,"sickkk, it`s been two days since summer started and it suck already!",0
1778,i got in a fight with ryan. now hes like crying and im just dead inside. sigggh,0
1783,Have a happy Friday and weekend everyone .. TGIF for me is nothing,1
1786,Studio Ghibli for this year; Ponyo! http://bit.ly/whar8 as always it seems to be perfect  we`ll be waiting till august for it,1
1788,"Brian (cat) still hasn`t shown up...I feel sad and sick, I`m afraid he`s been eaten by something.    It doesn`t look  good",0
1789,Missing Nate more than usual tonight,0
1792,Birthday tomorrow. Doing jack **** all weekend,0
1793,How Come I Can Never Sleep Past?? Not Good,0
1794,Just snuck out my window.. Now im laying on my roof looking at the stars. Its a nice night out tonight.,1
1795,"I just downloaded a ton of stunning, BEAUTIFUL wallpapers from www.interfacelift.com - go have a look.",1
1799,"'Patchouli oil & incense had a surge in popularity in the 1960s & 1970s, mostly among devotees of the free love & hippie lifestyles.'",1
1800,hi  godd day eweryone im in a reel good mood to day,1
1803, It takes a big man to type a sad tweet like that!,0
1805, I was going to but I`m stuck with it as I seem to have misplaced my remote  It`s extra bad tonight as well :|,0
1806, Big Thanks Melody!  Gotta love that sunshine-lots of vit D,1
1807,i got baby g wach its zi same as the 1 lady gaga wears in eh eh film clip but in pink!! I LOVE YOU KAY thanks a heap  i win olivia,1
1808,Hey! Let`s Follow each other! Wouldn`t that just be awesome!?,1
1809," loving the shoes perez, looking fine as always  oh,and lady gaga, what can I say. Outstanding!",1
1814, It`s a great movie - My best is the Welsh flatmate,1
1815," I got a headache because of all the hard work today, still not ready, with a #Heineken trying to finished up",0
1818, Im sad i cant go. it makes me sad,0
1822,so who is in for bring at HK lounge tomorrow ? $12 all you can drink till 5pm... then kareoke. I think it will be a nice Sunday!,1
1823, oh ****! I completely forgot about Thirsty Thursday! oh. my. gaga. this sucks,0
1825, i do but is just a haul vid/photo slideshow only. I only do it for fun  http://www.youtube.com/eyezaddiction,1
1826,feeling so great!,1
1829,I Wanna be @ JET in the Mirage...     Couldn`t get to Hawaii either   *****Someday***** Much Love To THE_WOCKEEZ and SuperCr3w,1
1830,Just finished yet another amazing book by Susan Elizabeth Philips!!!  God I love her books so much!!! Which one to read next??? hmmm...,1
1831,_O_C I`m seriously screwed  I haven`t studied at all!!!! :`(,0
1839, HAPPY MOTHERS DAY!  Tell ur mom that`s she an awesome madre & such a great example to the Archuleta familia!!,1
1840," Good morning to you, however it`s night time for me, so I am off to bed *hugs* Have a great day",1
1841,But I do know is that I am extremely happy with him and wouldn`t change him for the world and don`t want anybody else.,1
1842,Getting the FAB portraits ready to upload today,1
1843, You have DSL? Welcome to 2009!,1
1845,its too hot in my room. i wanna go swimming.,0
1847, http://twitpic.com/4so0u - OOO i wish i was her  he`s hot,1
1851,It`s sooo hot 2day!! Put a ton of sunblock on before jogging; still think my face burnt though!,0
1853, took my forum access away   fail.,0
1855," hahaha! Guess you will have to reinforce your skates, haha... Remember who u r my friend, our semi-God with a gluten intolence",1
1857,the day goes on and on...i think im gonna write a song about it! still thinking it�s impossible for me to get a true friend  why????,0
1858,"OMG i meant  <3 you`re the perfect Wolverine,sir  hehe",1
1868," very well, nothing flash - but different to chocolate 4 a change. good 2 meet U yesterday  gr8 atmosphere & discussion",1
1869,I took my antibiotics and I still feel like ****,0
1871,...Nomore adventure time,0
1872,"happy bank holiday Monday, Tweeteramas! I`ll be spending the day doing yoga and having OCD attacks. You?",1
1873,"Laura`s gone for the weekend, I miss her already!",0
1874,had nutella croissant+mango+melon+coffee and a lovely stalk of iris for breakfast in bed courtesy of N  Have the house to myself til noon,1
1875,Whuuurrrrr - glands really swollen now. Guess the weekend`s a blow out.,0
1877,LAZZZZZZZZZZZZZZZY MONDAY !! Bank Holiday  Nicole why haven`t u direct msged me yet ?!!!,0
1878,"Yummy yum-cha for mother`s day with mum, dad, arcel and egg-pants  yuuuuuum  http://twitpic.com/4w65x",1
1879,5 things this Twitterer could do without  http://MikeFrizzi.com/blog/?p=192 SRC  / I like this guy.,1
1883," HAHAAH! Crys, you blowing the fuses is a typical move",0
1887," We`re off.  I`m sorry. Parents coming in around 10-11, gonna eat with them, then house-hunt in Richardson. RAAAAIN CHEEECK",0
1888,Just saw a dooope bmw 6 series parked with the top back....to bad it was raining,0
1890," ha ha, no, will be thankful i am not dragging them up a mountain today",1
1891,"Had a great time with mpix shootout, just great  thanks mpix...",1
1892,"Weather is lovely, I`m headed home via supermarket. Planning to spend some quality time knitting tonight.",1
1893,sad ending to the softball season.,0
1894,Women in Science & Technology conference in La Jolla - what an interesting day!  Met some really great people!,1
1901,. very much enjoyed your 'whats in a name' article,1
1905,eating my roommate`s cereal. sorry bro,0
1906, Good news about the tooth!,1
1907," Yeah, I`m behind on my classic cinema calendar-making. I haven`t had time to go see any anyway.",0
1908,Aww the little girl on Britain`s Got Talent!  I actually love Ant n Dec!  Oh an` Simon Cowell. ;),1
1910, it was amazing but due to time constraints could only visit the meadows and pine forest. Shall post images later.,1
1913,LOVE ME LOVE ME SAY THAT YOU LOVE ME...,1
1919,Happy Mother`s Day everyone,1
1920,"Emergency Radio for iPhone is awesome, listening to Johnson County Sheriffs live scanner stream",1
1921, thanks so much for the belated #followfriday shout out #payingitforward,1
1922,Mommas day is may 10th! Don`t forget to do something nice for your mommyyy,1
1923," **** brah, u not happy?",0
1924, hah i`ma knock on wood but my PC has never crashed yet..nor my laptop  but then i`m careful with stuff so maybe that`s y,1
1926, happy birthdayyy! hope you have an awesome day. didn`t see you at next last night!,1
1934, Aren`t we though? lol He`s at work now and I miss him  blah Wut cha up to?,0
1935," I keep trying to invite  out, but I think she`s afraid of me.",0
1936, thanks for the #followfriday as you can see us South Africans were on holiday on fri,1
1937,ahhh!!!! u know what really sucks??? i sprained my toe!! OUCH!!,0
1939, Which denomination? I`m at the library and everything`s blocked.,0
1941, Good luck at the services tomorrow!! I wish I could see you guys on your vacation!,1
1942," Hey, sorry I got off last night!",0
1943, Yo Thomas! thanks for the follow  Social Media Director at Disney? That`s awesome! I`d like to learn more! Lets do lunch,1
1944,"Gosh I miss singer`s theater.  I miss learning music, doing acting exercises, n I ESPECIALLY miss being onstage.",0
1945,Good episode of Top Gear tonight.,1
1946,awhile ago it freaking hot! now it`s wet  turn off!,0
1948," ta babe, you know me i do love your curried",1
1951, so sad i have to pay $60,0
1952, i made a vid for you proving my skiLLs that you denied but my step dad said he`d disown me if i posted it ~   sowey,0
1956,Monday morning bathing - soooo relaxing! If I was a lady of luxury I would start every day like this,1
1957,my msn crashes way too much  hmph,0
1958,"Im so angry right now .. today im not doind nothing and all my classmates yes  ,i think i will stay with my friend Mr.Computer .. hope not",0
1960,hey thanks for the follow  ..,1
1961,Enjoyed Star Trek... More please,1
1963,"I can`t sleep, this is so darn frustrating.",0
1964, I don`t want to be a complete hypocrite - I attended an R-rated event while I was there - the timing was just ironic.,0
1967,I have been awarded my first ever credit card,1
1970, hey that is pretty good sucking up - my daughter is exactly the same - glad to see I am not alone   Good luck mom,1
1973,says Happy Mother`s Day to all the Moms out there.,1
1976," Oh, final msg - Why didn`t you review my boardgame Bookchase� when you were on telly? We didn`t even get a nice letter..",0
1977,"staying afterschool today  not that i have any 'friends' on here - but if i did , i`d tell `em to text me ! lol [ likin` us <3 ]",1
1980, it is my honor,1
1981,Man i am being boring today not tweeting  How are you guys?,0
1983,Cut my thumb with the saw in small metals   again...,0
1984,is loving Mortal Combat right now!,1
1986,Now I`m depressed again..ugh!!! HELP!!!,0
1987,My spellingis awful on twiiter,0
1990,Start of diet today  I think I have to face I will never get back down to 77kilos (unless I cut a leg off)�,0
1991,"mmm, pizza for dinner. yum. but i burnt my mouth though ..",1
1992,screw the fact you can`t post LONG updates on twitter,0
1993,**** awake at 2 am !  i hate sickness,0
1995,Inspired to blog about something inspirational. Haha.,1
1996,"Happy Mother`s Day to everyone`s mothers, mothers-to-be, grandmothers, great grandmothers...All the WOMEN! I salute you all",1
1999, awwww yur a awesome mother keep up the good work,1
2000,Pissed that my bluetooth headset`s battery out lasted my cell`s battery... Gg moto q.,0
2002,ayy fml. nothing is perfect,0
2007," if I have 5000 friend requests tomorrow, I`m blaming you  nite",0
2008,"Namaste! Hooray for Monday! Undaunted by a 3am wakeup, I consider it is 9am in London and feel justified. Bright side to everything!",1
2010, Great idea,1
2011,i want to sleep XD !!!! but i have a song in my head that make me crazy and dont know if i write the song or not hahhaha,1
2012,would some one plese suggest me a great thriller movie,1
2014, Yes I think so unless it changed.  I sent u a happy mothers day text but u never responded back,0
2019, knackered! been awake since 5 as couldn`t sleep! just started work now. coffee and toast sounds awesome  chris has been busy!,1
2020,"I don`t care about netsexor cams or the route to heaven, however, #lobster sounds super good.  I`m almost tempted to go get some.",1
2021,Nevermind! Beyonce doesn`t have a Twitter  Haha,1
2024," no he sabido nada de ti, this is making me a bit sad I must say!",0
2025,I missed the math trade,0
2026,Down in Wellington for the Monet Exhibition. Casually just bumped into Wayne Brady in our hotel lobby!!  Mega exciting!!!,1
2029,_queen like it,1
2031,I am going to die tomorrow night.   should be here.,0
2033, Nooooo!  Working this weekend,0
2038,Justin Timberlake and Andy Samberg do it again.. Mother Lover skit on SNL was great,1
2041,"thought id tanned after an hour in the sun, i was wrong....i`ve just burnt",0
2043, I work for Disney...not all it`s cracked up ta be.,0
2044,WTF rehearsal  off  got to space and room was booked and the  brothers have stuff right after so we cant transfer to another room studio,0
2053,hey guys y did the sun make my day gloomy?,0
2054,texting my friends and being bored...   gosh i hate rain!!,0
2057, yup its working. they couldn`t recover anything on it though,0
2058,rearry rip. Youd never guess what i ate..,0
2059,  Well I was following you because I think your interesting ... and I was right,1
2060,I`d love too see you were it ,1
2061,_andersen thank you Eric!  glad u appreciate that!,1
2062,18 hours to work....*cry* i can`t survive!  // Weeelcome to my wonderland *sing along*,0
2063,anyone have tickets to the mtv movie awards? some guy scammed me,0
2066,nothing to do this evening.. MISSING LIFESTORY,0
2070,being a computer geek is entertaining.... i think.,1
2071,  I miss you,0
2073, D: But it is making people unhappy and I dun like unhappiness,0
2074,Oh god! I had to look at 'How to use Twitter'.. how hopeless is that?!,0
2075,studying for this **** econ test,0
2076, no problem! i think it`s a great thing to reflect on.,1
2079,iamkiara__  im so sick  I fell over last night outside coz I was putting something in the bin,0
2082," Nice! Elise rolled out  Thas wassup! Have fun, ladies!",1
2083, have a safe ride up the coast. Don`t be going 90 even though you can.  when its windy just smile cuz u know u have it better.,1
2085,"have to wear my glasses today, cos my right eye is swollen and i don`t know why",0
2087,I love my boy  he makes me so happy... and looks his sexiest in plain black boxers =p,1
2090, WOOHOOO very cool see I knew u would get to see her,1
2094,"He can`t fix it.   I guess I`ll write until I get too bored then watch tv. Man, this is lame.",0
2095,wishes happy mothers` day to all moms out there.,1
2096,": Potter, are also in that category! Hehe. <3 I love you too!!! So much",1
2098," SUPER EXCITED. JUST BOUGHT MY TIX TO SEE HEY MONDAY ON 6/20. AGAIN.  ~SVETLANA J. DENVER,CO",1
2101, try #fireflight first... female fronted metal is awesome..  ..  Unbreakable album would be a good start!,1
2103, I`m not sure about this tweet business  Why are the simple things so difficult?,0
2105,With  walking the streets of Harlem. Home sweet home,1
2107, JUST like to clarify that I am a unable to acc. review vibrators as have not testrun any. *not an invitaiton for freebies,0
2108,Momma martini went food shopping without me!!!!,0
2109,"  Where I live, all the small markets deliver their day-old bread to the food bank, but times are really tough, even for me",0
2110,Good Morning. It`s Friday and the start of my work week  But... Lakers are going to take the 4th W tonight. Woohoo GO LAKERS!!!!,1
2111,"really tired. and have to work the whole day tomorrow, the thought of it depresses me.  uncoooool....",0
2112, Once James Cameron touches something and revolutionizes it... someone else comes along and **** it up,0
2113, I KNO!!! im so sad! evry1 is leavin its horrible! im supposed to b happy for summer but i cant ima miss evry1!,0
2115, Good morning Dan! It`s my Bday and I plan on getting some exercise too today!!  Love ya!! See you in NYC!!!,1
2117,is tired and sad,0
2118,They`re gone.,0
2120, http://twitpic.com/67swx - i wish i was calling you but i can`t from Malta,1
2121,Have hardly worked out in the last two weeks but am losing weight.  Fear I`m losing muscle!!  Just made doc. appt. for injured foot,0
2126, Fighter - Christina Aguilera. LOVE that song,1
2129, I know it`s against the law... I am a rebel in small things.,1
2130," Thanks to TweetStats, I confirmed what I long suspected: Twitter is keeping me up way too late!  ht.. http://twurl.nl/oaerf4",1
2131, BabyLove em homenagem ao Baby D,1
2132,won`t be going to the Oxford Internet Institute Sunner Doctoral Programme in Brisbane: lack of funding,0
2134, all ur pic it`s so nice  look so cute..oh!!,1
2135,"watching a film, recovering from my operation",1
2137,i`m going to kill myself T_T . i wasted hundreds of download and realised i got the wrong one,0
2139,"School is going to be absolutely horrible today. Peace out, `09",0
2140, http://twitpic.com/4wh5x - LUCKY! I`m so jealous even though I don`t like her that much,0
2141, sadface,0
2143,_hand Oops! I completely forgot!,0
2145,dam i missed hollyoaks 2nite!,0
2146, there`s relisting fees when you don`t complete a sale?  that sucks!,0
2147,   _coach   IMHO this soft is the best to keep the chaos straight   http://bit.ly/yuFil,1
2151, http://twitpic.com/4u5h8 - leon looks supa` fly on that mini couch,1
2152,_carter Hey Brian Littrell is there!! He doesnt really like this kinda pages rigth?  kisses! I loev you guys!,1
2153," did you go to uga? If so, I liked you better before I knew! Ha!",1
2155,I`m feel deflated. Ugh. No more dog.,0
2156,"_grant  Hey Donna, lovely to see you on Twitter.",1
2157,  read something happy?,1
2160,Well that is nice.  Loving the new Friends organiser too.,1
2162, I REEEALLY wish I could be there  haven`t been n a while.what`s goin on down there lately?,1
2167, you look sooooo pretty love. dang I wish I was in NY so I could c u do ur thang,1
2169,Aaaaaaaa!! I hate **** winshit!!,0
2170,Ugh i hate not having my car!! i miss you my little ford focus!!!,0
2171,"To every mom, mommy and mother, Happy Mother`s Day   Hope you all do something special and fun today.",1
2173,is soo in love with beyonce`s song 'smash into you',1
2177, that sucks,0
2183,_iddon blerrrrrrrrrrgh. im too hot and all sticky,0
2185,i feel very ill. i think im dehydrated,0
2187,I think Steph will enjoy her first Mother`s Day tomorrow.,1
2189,"over LT training today, ehhh hard to tall how hard it was. But now I feels good. Sunday race day again... Its raining now so lost of mud",1
2190,whos going to see reemer on wednesdayy  me and kirsty are going (A) im well exited !!!,1
2191, I miss having u as a roommate,0
2192, jersey weather - and good on you for the charity drive!,1
2195,Happy Mother`s day VALK!!,1
2197,would like to have a gaming system,1
2199,"_rosaen i LOVE your new bracelets!! im a very proud sista...you rock, girly",1
